secID,ticker,exchangeCD,ListSectorCD,ListSector,transCurrCD,secShortName,secFullName,listStatusCD,listDate,delistDate,equTypeCD,equType,exCountryCD,partyID,totalShares,nonrestFloatShares,nonrestfloatA,officeAddr,primeOperating
"300125.XSHE","300125","XSHE",2,"创业板","CNY","易世达","大连易世达新能源发展股份有限公司","L","2010-10-13",,"A","沪深A股","CHN",38353,118000000,97492100,97492100,"辽宁省大连市高新园区火炬路32号B座18F","余热发电技术、环保、节能、新能源工程的设计、技术开发、技术咨询、技术服务、技术转让、工程安装及工程总承包；机械、电气、自动化控制设备及其零部件的研发、组装、销售（以上项目涉及资质许可证的凭资质证经营）；货物进出口、技术进出口（法律、行政法规禁止的项目除外；法律、行政法规限制的项目取得许可后方可经营）。"
"300126.XSHE","300126","XSHE",2,"创业板","CNY","锐奇股份","上海锐奇工具股份有限公司","L","2010-10-13",,"A","沪深A股","CHN",38055,307308000,189815904,189815904,"上海市松江区新桥镇新茸路5号","电机、电动工具自产自销，模具生产；电机，电动工具，模具领域内的技术开发、技术咨询、技术转让、技术服务；电机，电动工具维修（除特种）；机电产品，五金交电销售；从事货物及技术的进出口业务（企业经营涉及行政许可的，凭许可证件经营）。"
"300127.XSHE","300127","XSHE",2,"创业板","CNY","银河磁体","成都银河磁体股份有限公司","L","2010-10-13",,"A","沪深A股","CHN",38575,323146360,221864890,221864890,"四川省成都市高新技术开发区西区百草路6号","制造、销售永磁合金元件及光机电高新技术服务；经营本企业自产机电产品、成套设备及相关技术的出口业务和本企业生产、科研所需原料、机械设备、仪器仪表、备品备件、零配件及技术进出口业务与“三来一补”业务。"
"300128.XSHE","300128","XSHE",2,"创业板","CNY","锦富新材","苏州锦富新材料股份有限公司","L","2010-10-13",,"A","沪深A股","CHN",38245,505116080,403568000,403568000,"江苏省苏州市工业园区华池街时代广场24幢苏州国际金融中心11楼","加工各种高性能复合材料、高分子材料，提供自产产品的售后服务，手机软件、计算机软件(含游戏)开发（涉及行政许可证的，凭许可证经营）。"
"300129.XSHE","300129","XSHE",2,"创业板","CNY","泰胜风能","上海泰胜风能装备股份有限公司","L","2010-10-19",,"A","沪深A股","CHN",38166,324000000,219533754,219533754,"上海市金山区卫清东路1988号","风力发电设备，钢结构，化工设备制造安装，各类海洋工程设备、设施、平台的设计、建造、组装、销售，从事货物和技术的进出口业务，风力发电设备、辅件、零件销售。"
"300130.XSHE","300130","XSHE",2,"创业板","CNY","新国都","深圳市新国都技术股份有限公司","L","2010-10-19",,"A","沪深A股","CHN",38666,114300000,73698750,73698750,"广东省深圳市福田区深南路车公庙工业区泰然劲松大厦17A","一般经营项目：货物及技术的进出口业务。      许可经营项目：银行卡电子支付终端产品（POS机）、电子支付密码系统产品、计算机产品及电子产品的技术开发、生产（生产项目由分支机构经营）、销售、租赁及服务（不含专营、专控、转卖商品及限制项目）；移动支付业务的技术开发运营及服务（不含生产）；互联网信息业务。"
"300131.XSHE","300131","XSHE",2,"创业板","CNY","英唐智控","深圳市英唐智能控制股份有限公司","L","2010-10-19",,"A","沪深A股","CHN",38712,404405988,265479766,265479766,"广东省深圳市南山区高新技术产业园高新南五道英唐大厦五楼","智能控制产品软硬件、数码电子产品软硬件、光机电一体产品软硬件、无线电子产品软硬件、汽车电子产品软硬件、数字电视机顶盒软硬件、卫星电视接收设备软硬件、电气自动化设备软硬件、自动化软硬件系统及工程、电脑产品软硬件、电子音像设备的开发、技术转让及销售（以上不含专营、专控、专卖商品及限制项目）；电子元器件、通讯器材、仪表及设备的购销；货物及技术进出口。      （以上均不含法律、行政法规、国务院决定规定需前置审批和禁止的项目）智能控制产品、数码电子产品、光机电一体产品、无线电子产品、数字电视机顶盒、卫星电视接收设备、电气自动化设备的生产。"
"300132.XSHE","300132","XSHE",2,"创业板","CNY","青松股份","福建青松股份有限公司","L","2010-10-26",,"A","沪深A股","CHN",38723,385920000,236009792,236009792,"福建省南平市建阳市回瑶工业园区","药用辅料(樟脑)、原料药（樟脑）、中药饮片（冰片）的生产(有效期至2015年12月31日)；2-莰醇（冰片）、2-莰酮（樟脑）、莰烯、双戊烯的生产（有效期限至2015年1月21日）；二甲苯、液碱、冰醋酸、松节油、溶剂油、硫酸（剧毒品除外）的批发（有效期至2015年6月22日）；化工产品（不含化学危险品）、香料及香料油的生产；机械设备、仪器仪表及零配件销售；对外贸易。（以上经营范围涉及许可经营项目的，应在取得有关部门的许可后方可经营）。"
"300133.XSHE","300133","XSHE",2,"创业板","CNY","华策影视","浙江华策影视股份有限公司","L","2010-10-26",,"A","沪深A股","CHN",38165,652871758,465046855,465046855,"浙江省杭州市文二西路683号西溪创意产业园C-C座","许可经营项目：制作、复制、发行：专题、专栏、综艺、动画片、广播剧、电视剧（有效期限至2015年04月01日）。      一般经营项目：设计、制作、代理国内广告。经济信息咨询（除证券、期货）；承办会务、礼仪服务；经营进出口业务。（上述经营范围不含国家法律法规规定禁止、限制和许可经营的项目。）。"
"300134.XSHE","300134","XSHE",2,"创业板","CNY","大富科技","深圳市大富科技股份有限公司","L","2010-10-26",,"A","沪深A股","CHN",38667,652800000,597720000,597720000,"广东省深圳市宝安区沙井街道蚝乡路沙井工业公司第三工业区A2","研制、生产、销售、维护移动通信设备及其配件、数据通信设备及其配件、通信传输设备及其配件、电源产品及其配件、无线通信设备及其配件、宽带多媒体设备、终端设备及其配件、安防设备及配件；承接系统集成工程（不含限制项目）；滤波器、合路器、分路器、隔离器、耦合器、微波元器件及金属件表面喷粉的研发、生产与销售；从事计算机辅助设计、辅助测试、辅助制造、辅助工程系统及其他计算机应用系统的研发（法律、行政法规、国务院决定禁止及规定在登记前须批准的项目除外）；国内贸易（不含专营、专控、专卖商品）；从事货物、技术进出口业务。从事产业发展战略规划和产业政策相关领域的研究；提供产业经济管理项目咨询服务；经济市场调研。"
"300135.XSHE","300135","XSHE",2,"创业板","CNY","宝利沥青","江苏宝利沥青股份有限公司","L","2010-10-26",,"A","沪深A股","CHN",38668,512000000,363583056,363583056,"江苏省无锡市江阴市云亭镇工业园区","高等级公路新材料的研发、生产和销售，主营产品为通用型改性沥青、高强度结构沥青料、高铁专用乳化沥青、废橡塑改性沥青等专业沥青；公司产品广泛应用于高速公路、桥梁、市政道路及高速铁路等路面建设；公司储备了多项新型改性沥青产品的生产技术，形成了“生产一代、储备一代、在研一代”的健康研发体系。"
"300136.XSHE","300136","XSHE",2,"创业板","CNY","信维通信","深圳市信维通信股份有限公司","L","2010-11-05",,"A","沪深A股","CHN",38888,272259000,202147473,202147473,"广东省深圳市宝安区沙井沙一万安路长兴高新技术工业园8号楼、9号楼","一般经营项目：移动终端天线、3G终端天线、模组天线、3D精密成型天线、高性能天线连接器、音频模组的设计、技术开发和销售；电子产品的销售；国内商业、物资供销业；货物及技术进出口。（以上项目均不含法律、行政法规、国务院决定规定需前置审批及禁止项目）。      许可经营项目：移动终端天线、3G终端天线、模组天线、3D精密成型天线、高性能天线连接器、音频模组的生产；电子产品的生产。"
"300137.XSHE","300137","XSHE",2,"创业板","CNY","先河环保","河北先河环保科技股份有限公司","L","2010-11-05",,"A","沪深A股","CHN",38724,324480000,263781557,263781557,"河北省石家庄市湘江道251号","从事计量仪器、环保设备的研制开发；化工产品（不含化学危险品）、电子产品、五金交电、仪器、仪表、针纺织品、塑料制品、橡胶制品、通讯器材（不含无线电移动电话、地面卫星接收设备）的批发、零售；软件产品的开发、生产和销售；环境监测仪器的研制、生产、销售；产品的自营进出口（法律法规、国务院禁止或限制经营的除外）。计算机信息系统集成服务，环境监测仪器的维修、运营服务。"
"300138.XSHE","300138","XSHE",2,"创业板","CNY","晨光生物","晨光生物科技集团股份有限公司","L","2010-11-05",,"A","沪深A股","CHN",37567,179570872,126084225,126084225,"河北省邯郸市曲周县城晨光路1号","食品添加剂：红米红、甜菜红、茶多酚、甜菊糖苷、叶黄素、辣椒红、姜黄色素、番茄红、辣椒油树脂；调味料（调味油）。单一饲料“畜禽用果渣”；着色剂（I）辣椒红、天然叶黄素（源自万寿菊）的生产及销售。收购色素原料，自营和代理各类商品和技术的进出口（但国家限定或禁止进出口的商品和技术除外）；以下限分公司经营：辣椒红、甜菜红、姜黄素检测服务；辣椒处理、粉碎、磨粉、造粒，红米红、甜菊糖苷、红曲米（粉）、甜菜红萃取、调配包装；食用植物油（半精炼、全精炼）、食用植物油（全精炼）（分装）、棉籽油、葡萄籽油、玉米油、红花籽油、大豆油（分装）、葵花籽油、分提棕榈油、食用调和油；棉短绒、棉壳、黑米渣、脱酚棉籽蛋白的生产及销售。"
"300139.XSHE","300139","XSHE",2,"创业板","CNY","福星晓程","北京福星晓程电子科技股份有限公司","L","2010-11-12",,"A","沪深A股","CHN",36116,274000000,212161047,212161047,"北京市海淀区西三环北路87号国际财经中心D座503","承接网络系统集成;自营和代理各类商品及技术的进出口业务，但国家限定公司经营或禁止进出口的商品及技术除外。"
"300140.XSHE","300140","XSHE",2,"创业板","CNY","启源装备","西安启源机电装备股份有限公司","L","2010-11-12",,"A","沪深A股","CHN",39211,122000000,115348157,115348157,"陕西省西安市经济技术开发区凤城十二路98号","变压器专用设备及组件的设计、开发、制造、销售、服务。"
"300141.XSHE","300141","XSHE",2,"创业板","CNY","和顺电气","苏州工业园区和顺电气股份有限公司","L","2010-11-12",,"A","沪深A股","CHN",39210,166740300,105739669,105739669,"江苏省苏州市工业园区和顺路8号","一般经营项目：高低压电器及成套设备、电工器材、电力滤波装置、无功补偿装置、电力储能装置及其它电力电子类环保节电装置的研发、制造、销售；并提供相关产品的方案设计、安装、调试及其它售后服务；自有房屋出租；设备出租。"
"300142.XSHE","300142","XSHE",2,"创业板","CNY","沃森生物","云南沃森生物技术股份有限公司","L","2010-11-12",,"A","沪深A股","CHN",38989,234000000,166058564,166058564,"云南省昆明市高新开发区北区云南大学科技园2期A3幢4楼","生物制剂的研究与开发（不含管理商品）；生物项目的引进、合作与开发；生物技术相关项目的技术服务研究与开发；技术进出口。"
"300143.XSHE","300143","XSHE",2,"创业板","CNY","星河生物","广东星河生物科技股份有限公司","L","2010-12-09",,"A","沪深A股","CHN",37319,147400000,105879202,105879202,"广东省东莞市塘厦镇蛟坪大道83号","种植、加工、销售食用菌等农副产品，食（药）用菌和其他有益微生物育种、引种及相关产品的研究和开发，食（药）用菌高效生产工艺及其培养基再利用技术的研究和开发；货物进出口、技术进出口（法律、行政法规禁止的项目除外；法律、行政法规限制的项目须取得许可后方可经营）。"
"300144.XSHE","300144","XSHE",2,"创业板","CNY","宋城演艺","宋城演艺发展股份有限公司","L","2010-12-09",,"A","沪深A股","CHN",39367,557775000,506141815,506141815,"浙江省杭州市西湖区之江路148号","旅游服务，主题公园开发经营，文化活动策划、组织，文化传播策划，餐饮，动漫设计，会展组织，休闲产业投资开发，实业投资，旅游电子商务、旅游用品及工艺美术品（不含金饰品）、百货、土特产品（不含食品）的销售；含下属分支机构的经营范围。（上述经营范围不含国家法律法规规定禁止、限制和许可经营的项目。"
"300145.XSHE","300145","XSHE",2,"创业板","CNY","南方泵业","南方泵业股份有限公司","L","2010-12-09",,"A","沪深A股","CHN",39479,262307520,174170122,174170122,"浙江省杭州市余杭区仁和镇","一般经营范围：水泵、电机、金属冲压件、紧固件、不锈钢精密铸件、供水设备、配电柜的制造、木板加工，切削加工；收购本企业生产所需的原辅材料，经营进出口业务。"
"300146.XSHE","300146","XSHE",2,"创业板","CNY","汤臣倍健","汤臣倍健股份有限公司","L","2010-12-15",,"A","沪深A股","CHN",39617,728010940,337431540,337431540,"广东省广州市萝岗区科学城科学大道中99号科汇金谷3街3号","研发、生产和销售保健食品；研发、生产和销售片型、粉型、胶囊型食品（不含保健食品、新资源食品、特殊人群食品）；批发兼零售：预包装食品、乳制品（含婴幼儿配方乳粉）；研发和销售包装材料；研发生物技术；商务服务（不含许可经营项目）；中药材种植（不含许可经营项目）。"
"300147.XSHE","300147","XSHE",2,"创业板","CNY","香雪制药","广州市香雪制药股份有限公司","L","2010-12-15",,"A","沪深A股","CHN",39729,509573329,508061007,508061007,"广东省广州市萝岗区广州经济技术开发区科学城金峰园路2号","中药材种植；生产气雾剂，片剂、硬胶囊剂（含头孢菌素类），颗粒剂，口服液，合剂，口服溶液剂，中药饮片，中药前处理及提取车间（口服制剂）（按有效许可证经营）；经营本企业自产产品及相关技术的出口业务，经营本企业生产、科研所需的原辅材料、机械设备、仪器仪表、零配件及相关技术的进出口业务，经营本企业的进料加工和“三来一补”业务（具体按资格证书经营）；市场策划，企业管理咨询。"
"300148.XSHE","300148","XSHE",2,"创业板","CNY","天舟文化","天舟文化股份有限公司","L","2010-12-15",,"A","沪深A股","CHN",39480,351959591,227029130,227029130,"湖南省长沙市东二环二段194号天域新都商务楼四楼","图书、报纸、期刊、电子出版物总发行（出版物经营许可证有效期至2014年4月30日），文化用品、办公用品、文教科研仪器、工艺品、文化艺术品的销售；电化教学仪器智能化综合布线设计、制作、发布户外广告；文化项目策划；书刊项目的设计、策划；著作权代理；教育、教学软件及信息系统的开发；教育咨询。（涉及行政许可的凭许可证经营）。"
"300149.XSHE","300149","XSHE",2,"创业板","CNY","量子高科","量子高科(中国)生物股份有限公司","L","2010-12-22",,"A","沪深A股","CHN",39618,301500000,199533656,199533656,"广东省江门市高新区高新西路133号","保健食品（国内保健食品批准证书范围内产品）的研发、生产、销售及技术转让；淀粉糖、低聚半乳糖、调味料（固态、液体）、饮料、蜂产品、茶叶及相关制品、糖果制品等预包装食品、新资源食品、特殊膳食食品、食品添加剂及酶制剂、医药辅料、饲料添加剂的研发、生产、销售；医药技术研发、技术咨询和技术转让；生物技术的开发和转让；      研发、销售包装材料；健康管理服务(不含医疗服务)、咨询、生物健康技术开发；经营本企业生产、科研所需的原辅材料、产品、仪器仪表、机械设备、零配件及相关技术的进出口业务；批发、零售：预包装食品、乳制品、保健食品、化妆品、日用品、保健仪器、检测仪器、理疗仪器。（以上经营范围涉及前置审批的项目凭相关许可证核准的经营范围经营，未取得前置许可证的不得经营。上述经营范围不涉及国营贸易管理商品，涉及配额、许可证管理商品的，按国家有关规定办理申请）。"
"300150.XSHE","300150","XSHE",2,"创业板","CNY","世纪瑞尔","北京世纪瑞尔技术股份有限公司","L","2010-12-22",,"A","沪深A股","CHN",1935,270000000,178864236,178864236,"北京市海淀区上地信息路22号上地科技综合楼B座九、十层","销售医疗器械Ⅲ、Ⅱ类：医用光学器具、仪器及内窥镜设备（6822-1除外）；生产电子产品、计算机软硬件、工业自动化设备、通信及网络产品、机电产品、监控设备；专业承包；技术开发；技术推广；技术咨询；技术服务；技术培训；销售电子产品、计算机、软件及辅助设备、通信及网络产品、机电产品、工业自动化设备、仪器仪表；计算机系统服务；应用软件服务；租赁计算机及辅助设备；技术进出口；代理进出口；货物进出口。"
"300151.XSHE","300151","XSHE",2,"创业板","CNY","昌红科技","深圳市昌红科技股份有限公司","L","2010-12-22",,"A","沪深A股","CHN",39694,201000000,106325812,106325812,"广东省深圳市龙岗区坪山街道锦龙大道西侧","非金属制品模具设计、加工、制造；塑料制品、模具、五金制造（以上项目不含限制项目）；消费性电子产品的生产加工；经营进出口业务（法律、行政法规、国务院决定禁止的项目除外，限制的项目须取得许可后方可经营）；模具技术咨询及服务。"
"300152.XSHE","300152","XSHE",2,"创业板","CNY","燃控科技","徐州燃控科技股份有限公司","L","2010-12-29",,"A","沪深A股","CHN",37691,237600000,237600000,237600000,"江苏省徐州市经济开发区杨山路12号","燃烧及控制、节能、环保及新能源设备、锅炉、钢结构的工程设计、制造、成套、销售、安装、调试、运行及管理、咨询服务；房屋建筑工程总承包；各类商品和技术的进出口业务（国家限定企业经营或禁止进出口的商品和技术除外）。"
"300153.XSHE","300153","XSHE",2,"创业板","CNY","科泰电源","上海科泰电源股份有限公司","L","2010-12-29",,"A","沪深A股","CHN",39731,160000000,77356568,77356568,"上海市张江高新区青浦园天辰路1633号","新能源及柴油发电机组系统集成的开发、设计、制造；发电机组及机房环保降噪设备的设计、制造、安装，销售和租赁公司自产产品，并提供产品技术和售后服务。（涉及行政许可的凭许可证经营）。"
"300154.XSHE","300154","XSHE",2,"创业板","CNY","瑞凌股份","深圳市瑞凌实业股份有限公司","L","2010-12-29",,"A","沪深A股","CHN",39260,223500000,155703075,155703075,"广东省深圳市宝安区宝城67区隆昌路8号飞扬科技B栋2-6楼","逆变焊割设备的研发、生产、销售。"
"300155.XSHE","300155","XSHE",2,"创业板","CNY","安居宝","广东安居宝数码科技股份有限公司","L","2011-01-07",,"A","沪深A股","CHN",39693,365819583,177717250,177717250,"广东省广州市开发区科学城起云路6号安居宝科技园","电子、通信与自动控制技术研究、开发；电子工程设计服务；安全智能卡类设备和系统制造；安全系统监控服务；电子元件及组件制造；电子自动化工程安装服务；计算机应用电子设备制造；智能化安装工程服务；信息系统集成服务；监控系统工程安装服务；楼宇设备自控系统工程服务；机械式停车场设备制造；货物进出口（专营专控商品除外）；技术进出口；软件开发；软件服务；通信设施安装工程服务；通信系统工程服务；专业停车场服务。"
"300156.XSHE","300156","XSHE",2,"创业板","CNY","神雾环保","神雾环保技术股份有限公司","L","2011-01-07",,"A","沪深A股","CHN",38185,288720000,233673921,233673921,"北京市朝阳区将台路5号院15号楼C座7层","密闭炉成套设备制造（仅限分公司经营）；技术开发；技术咨询；技术服务；专业承包；销售、安装环保节能成套设备；以下项目仅限分公司经营：工业炉窑节能减排的技术开发；密闭炉成套设备安装、技术服务。"
"300157.XSHE","300157","XSHE",2,"创业板","CNY","恒泰艾普","恒泰艾普石油天然气技术服务股份有限公司","L","2011-01-07",,"A","沪深A股","CHN",39572,597702777,427131806,427131806,"北京市海淀区丰秀中路3号院4号楼401室","石油天然气勘探的技术开发、销售；计算机软件的开发、销售；石油天然气勘探技术培训、技术服务；货物进出口、技术进出口、代理进出口。"
"300158.XSHE","300158","XSHE",2,"创业板","CNY","振东制药","山西振东制药股份有限公司","L","2011-01-07",,"A","沪深A股","CHN",39500,288000000,288000000,288000000,"山西省长治县光明南路振东科技园","中药制剂（仅限原料药（比卡鲁胺、甘草酸二铵）、小容量注射剂、片剂（含抗肿瘤药）、硬胶囊剂（含抗肿瘤药）、颗粒剂）生产制造；消杀剂系列产品、保健品（仅限分支机构经营）、卫生用品销售；新药品开发（仅限研究）。（法律法规规定禁止经营的不得经营，规定需经有关部门审批的持许可证经营）。"
"300159.XSHE","300159","XSHE",2,"创业板","CNY","新研股份","新疆机械研究院股份有限公司","L","2011-01-07",,"A","沪深A股","CHN",39873,360800000,281531360,281531360,"新疆维吾尔自治区乌鲁木齐市北京北路239号","从事农牧业机械的研发、设计、生产和销售。"
"300160.XSHE","300160","XSHE",2,"创业板","CNY","秀强股份","江苏秀强玻璃工艺股份有限公司","L","2011-01-13",,"A","沪深A股","CHN",39890,186800000,186800000,186800000,"江苏省宿迁市高新技术产业开发区华山路98号","一般经营项目：实业投资、投资管理；财务顾问及相关咨询服务；自营和代理各类商品和技术的进出口业务，但国家限定企业经营或禁止进出口的商品和技术除外。"
"300161.XSHE","300161","XSHE",2,"创业板","CNY","华中数控","武汉华中数控股份有限公司","L","2011-01-13",,"A","沪深A股","CHN",30193,161745000,153793940,153793940,"湖北省武汉市洪山区珞喻路1037号","数控系统、机电一体化、电子、计算机、激光、通信等技术及产品的开发、研制、技术服务；开发产品的销售；机械及静电喷塑加工。"
"300162.XSHE","300162","XSHE",2,"创业板","CNY","雷曼光电","深圳雷曼光电科技股份有限公司","L","2011-01-13",,"A","沪深A股","CHN",39782,134000000,82730000,82730000,"广东省深圳市南山区西丽白芒百旺信工业园二区八栋","一般经营项目：节能环保工程，节能工程设计，节能技术咨询与评估；照明工程、城市亮化、景观工程的咨询、设计、安装、维护；货物的进出口（不含分销，不含专营、专控、专卖商品）；节能技术服务（不含限制项目）；设备租赁；能源管理；从事经营广告业务（法律、行政法规规定应进行广告经营审批登记的，另行办理审批登记后方可经营）。      许可经营项目：研发、生产经营高品级发光二极管及LED显示、照明及其他应用产品。"
"300163.XSHE","300163","XSHE",2,"创业板","CNY","先锋新材","宁波先锋新材料股份有限公司","L","2011-01-13",,"A","沪深A股","CHN",39889,158000000,95259244,95259244,"浙江省宁波市鄞州区集士港镇山下庄村","PVC玻纤高分子复合材料的制造；塑料制品、旅游帐篷、桌、椅、电子元件、电器配件、机电设备、五金配件、水暖洁具的制造、加工；有色金属的挤压、塑料造粒、塑料及金属门窗的加工；日用品、塑料原料及制品、金属材料及制品、工艺品的批发、零售；自营和代理各类商品和技术的进出口、但国家限定公司经营或禁止进出口的商品和技术除外。"
