secID,ticker,exchangeCD,ListSectorCD,ListSector,transCurrCD,secShortName,secFullName,listStatusCD,listDate,delistDate,equTypeCD,equType,exCountryCD,partyID,totalShares,nonrestFloatShares,nonrestfloatA,officeAddr,primeOperating
"600397.XSHG","600397","XSHG",1,"主板","CNY","安源煤业","安源煤业集团股份有限公司","L","2002-07-02",,"A","沪深A股","CHN",948,989959882,989959882,989959882,"江西省南昌市西湖区丁公路117号","煤炭开采、煤炭精选加工、煤炭经营（上述三项限分支机构经营），煤层气开发利用，对外贸易经营，矿产品销售，对各类行业的投资，国内贸易及生产、加工，仓储服务，货运代理，设备维修及租赁，房屋租赁，科学研究、信息和技术咨询服务。"
"600398.XSHG","600398","XSHG",1,"主板","CNY","海澜之家","海澜之家股份有限公司","L","2000-12-28",,"A","沪深A股","CHN",949,4492757924,1531219463,1531219463,"江苏省无锡市江阴市新桥镇","毛纺新技术、新产品、新材料、通讯产品的研发、销售，环保高新技术产品的开发及投资，精纺呢绒、毛纱、服装、针织品、衬衫、领带、袜子、纺织原料、劳动保护用品的制造，自营和代理各类商品及技术的进出口业务；自有房屋的租赁及物业管理。凯诺科技股份有限公司内部供电、供汽。码头和其他港口设施经营，在港区内从事货物装卸、驳运、仓储经营业务。"
"600399.XSHG","600399","XSHG",1,"主板","CNY","抚顺特钢","抚顺特殊钢股份有限公司","L","2000-12-29",,"A","沪深A股","CHN",950,520000000,451849120,451849120,"辽宁省抚顺市望花区鞍山路东段8号","经营本企业自产产品及技术的出口业务和本企业所需的机械设备、零配件、原辅材料及技术的进口业务（国家限定公司经营或禁止进出口的商品及技术除外），钢冶炼，压延钢加工，冶金技术服务，工业气体（含液体）制造、销售。"
"600400.XSHG","600400","XSHG",1,"主板","CNY","红豆股份","江苏红豆实业股份有限公司","L","2001-01-08",,"A","沪深A股","CHN",951,560399640,560399640,560399640,"江苏省无锡市锡山区港下镇","一般经营项目：服装、针织品、纺织品、机械、化学纤维的制造加工、销售，污水处理，工业用水经营。经营本企业自产产品的出口业务和本企业所需的机械设备、零部件、原辅料的进口业务。"
"600401.XSHG","600401","XSHG",1,"主板","CNY","海润光伏","海润光伏科技股份有限公司","L","2003-09-24",,"A","沪深A股","CHN",952,1574978384,1082478384,1082478384,"江苏省无锡市江阴市徐霞客镇璜塘工业园区环镇北路178号","研究、开发、生产、加工单晶硅片、单晶硅棒；多晶硅锭、多晶硅片。"
"600403.XSHG","600403","XSHG",1,"主板","CNY","大有能源","河南大有能源股份有限公司","L","2003-10-09",,"A","沪深A股","CHN",953,2390812402,2390812402,2390812402,"河南省三门峡市义马市千秋路6号","原煤开采（限分支机构凭有效许可证经营）；煤炭批发经营；对煤炭行业的投资；煤炭洗选加工（限分支机构经营）；自有铁路专用线煤炭运输；国内贸易；对外贸易（国家限定公司经营或禁止进出口的商品及技术除外）；技术服务、咨询服务（以上范围凡需审批的，未获批准前不得经营）。"
"600405.XSHG","600405","XSHG",1,"主板","CNY","动力源","北京动力源科技股份有限公司","L","2004-04-01",,"A","沪深A股","CHN",954,423892802,423892802,423892802,"北京市丰台区科学城星火路8号","自营和代理各类商品及技术的进出口业务，但国家限定公司经营或禁止进出口的商品及技术除外，经营进料加工和“三来一补”业务，经营对销贸易和转口贸易，代理出口将自行研制开发的技术转让给其他企业所生产的非自产产品；法律、法规禁止的，不得经营；应经审批的，未获审批前不得经营；法律、法规未规定审批的，企业自主选择经营项目，开展开展营活动。"
"600406.XSHG","600406","XSHG",1,"主板","CNY","国电南瑞","国电南瑞科技股份有限公司","L","2003-10-16",,"A","沪深A股","CHN",955,2428953351,2205753602,2205753602,"江苏省南京市高新技术产业开发区高新路20号","发电、输电、变电、配电、供电控制系统和设备；计算机及外部设备；通信交换、通信终端及通信设备（不含卫星地面接受设备）；工业自动化仪表、电工仪器、电子测量仪器，工业过程控制系统和装置设计、制造、销售、服务；电子计算机软件的研制、开发、服务。经营本企业自产产品及技术的出口业务；经营本企业生产、科研所需的原辅材料、仪器仪表、机械设备、零配件及技术的进口业务（国家限定公司经营和国家禁止进出口的商品及技术除外）；轨道交通技术开发、转让和服务，轨道交通控制系统、信号系统及控制设备和软件，轨道交通通信交换、通信终端及通信设备（不含卫星地面接收设备）。"
"600408.XSHG","600408","XSHG",1,"主板","CNY","安泰集团","山西安泰集团股份有限公司","L","2003-02-12",,"A","沪深A股","CHN",956,1006800000,1006800000,1006800000,"山西省晋中市介休市义安镇","生产、销售焦炭及其副产品、生铁、电力、矿渣细粉、碳素制品、化工产品（国家限制品除外）；煤炭洗选；石灰石开采，加工石料、石粉及白云石轻烧加工经营；货物运输；新产品开发；批发零售矿产品（除国家专控品）、化工原料（除易燃易爆易腐蚀危险品）、普通机械、汽车（除小轿车）、日杂百货、农副产品（除国家专控品）。自营和代理各类商品和技术的进出口业务，但国家限定经营或禁止经营的商品及技术除外。实业投资。"
"600409.XSHG","600409","XSHG",1,"主板","CNY","三友化工","唐山三友化工股份有限公司","L","2003-06-18",,"A","沪深A股","CHN",957,1850385487,1850385487,1850385487,"河北省唐山市南堡开发区","纯碱、食品添加剂碳酸钠及系列产品的生产、销售；经营本企业自产产品和技术的出口业务和本企业所需的原辅材料、机械设备、零配件及技术的进口业务，但国家限定公司经营和禁止进出口的商品及技术除外；化工机械设备制造、安装、维修、销售及相关技术服务；普通货运；房屋租赁。"
"600410.XSHG","600410","XSHG",1,"主板","CNY","华胜天成","北京华胜天成科技股份有限公司","L","2004-04-27",,"A","沪深A股","CHN",958,641323885,637445496,637445496,"北京市海淀区学清路8号科技财富中心A座10-11层","技术开发、技术咨询、技术服务、技术培训；承接计算机信息系统集成；销售计算机软、硬件及外围设备、通信设备；计算机软、硬件及外围设备、通信设备的售后服务；电子商务服务；货物进出口；技术进出口；代理进出口。"
"600415.XSHG","600415","XSHG",1,"主板","CNY","小商品城","浙江中国小商品城集团股份有限公司","L","2002-05-09",,"A","沪深A股","CHN",959,2721607088,2721607088,2721607088,"浙江省金华市义乌市福田路105号海洋商务写字楼","实业投资开发,市场开发经营,市场配套服务,金属材料、建筑装饰材料、百货、针纺织品、五金交电化工、办公设备通信设备（不含无线）、机电设备的销售,信息咨询服务。自营和代理内销商品范围内的进出口业务。经营进料加工和＂三来一补＂业务,经营对销贸易和转口贸易,含下属分支机构的经营范围。提供网上交易平台和服务，网上交易市场开发经营（以工商核定为准）。"
"600416.XSHG","600416","XSHG",1,"主板","CNY","湘电股份","湘潭电机股份有限公司","L","2002-07-18",,"A","沪深A股","CHN",960,743405176,608484542,608484542,"湖南省湘潭市下摄司街302号","生产、销售发电机、交直流电动机、特种电机、矿用电机车、电动轮自卸车、工矿配件、轻轨车、地铁车辆、电气成套设备、变压器、互感器。"
"600418.XSHG","600418","XSHG",1,"主板","CNY","江淮汽车","安徽江淮汽车股份有限公司","L","2001-08-24",,"A","沪深A股","CHN",961,1284905826,1069037586,1069037586,"安徽省合肥市东流路176号","汽车底盘、齿轮箱、汽车零部件开发、制造、销售；汽车开发、制造、销售；汽车修理；新技术开发、新产品研制；本企业自产产品和技术进出口及本企业生产所需的原辅材料、仪器仪表、机械设备、零配件及技术的进出口业务（国家限定公司经营和国家禁止进出口的商品及技术除外）；技术服务、技术转让。土地租赁、房屋租赁、设备租赁、汽车租赁。"
"600419.XSHG","600419","XSHG",1,"主板","CNY","天润乳业","新疆天润乳业股份有限公司","L","2001-06-28",,"A","沪深A股","CHN",962,86389415,80210837,80210837,"新疆维吾尔自治区乌鲁木齐市经济技术开发区(头屯河区)乌昌公路2702号","乳业投资及管理、畜牧业投资及管理；饲料加工、销售；农作物种植、加工；有机肥生产、销售；机械设备加工、维修；自营和代理各类商品和技术的进出口（国家限定公司经营和禁止进出口的商品和技术除外）；物业管理；房屋租赁；装饰装潢材料的销售。"
"600420.XSHG","600420","XSHG",1,"主板","CNY","现代制药","上海现代制药股份有限公司","L","2004-06-16",,"A","沪深A股","CHN",963,287733402,287733402,287733402,"上海市静安区北京西路1320号","药品，保健品制造，药用原辅料，制药机械批售，药品，保健品等产品的研究开发、技术转让、技术咨询、技术服务、技术培训，中药材饮片，中成药，来料加工及医院协定处方，消毒剂生产及销售，货物进出口业务及技术进出口业务、生产：大蒜油软胶囊、卵磷脂软胶囊、深海鱼油软胶囊。(上述经营范围涉及许可经营的凭许可证经营)。"
"600421.XSHG","600421","XSHG",1,"主板","CNY","仰帆控股","湖北仰帆控股股份有限公司","L","2004-06-07",,"A","沪深A股","CHN",964,195600000,195600000,195600000,"湖北省武汉市武昌区武珞路628号亚洲贸易广场B座22层","片剂、硬胶囊剂、颗粒剂、丸剂的生产；生物制品的生产、销售；生物、医药、环保、生态农业技术的开发、咨询及服务；生物、医药、环保、生态农业的开发；企业投资开发、房地产开发、经营。"
"600422.XSHG","600422","XSHG",1,"主板","CNY","昆药集团","昆药集团股份有限公司","L","2000-12-06",,"A","沪深A股","CHN",965,341130177,340355921,340355921,"云南省昆明市国家高新技术开发区科医路166号","中西药原料，制剂，医药原辅材料，中药材（种植），中间体，化工原料，包装材料，自产自销，批发零售，科技开发，咨询服务，机械加工，制药设备制造，安装及维修业务，医药工程设计。"
"600423.XSHG","600423","XSHG",1,"主板","CNY","柳化股份","柳州化工股份有限公司","L","2003-07-17",,"A","沪深A股","CHN",966,399347513,399347513,399347513,"广西壮族自治区柳州市柳北区北雀路67号","液氨、硝酸、甲醇、甲醛、硝酸铵、硝酸钠、亚硝酸钠、硫磺、硫酸、液氧、液氮、氩气、双氧水(过氧化氢)生产；氮肥、纯碱、复合肥料、蒸汽、系列工业水、生活水、脱盐水、硝基复合肥、重碱、氨水（≤35%浓度）生产销售；液氨、甲醛、甲醇、硝酸、硝酸铵、硝酸钠、亚硝酸钠、硫磺、硫酸、双氧水(过氧化氢)（20%≤含量≤60%）、盐酸、液体CO2、液氧、液氮、氩气的批发经营；化工（危险化学品除外）、化肥产品销售；煤炭批发；过磅收费服务；经营进出口业务（国家限定公司经营或禁止出口的商品除外）；经营本企业的进料加工和‘三来一补’业务。"
"600425.XSHG","600425","XSHG",1,"主板","CNY","青松建化","新疆青松建材化工(集团)股份有限公司","L","2003-07-24",,"A","沪深A股","CHN",967,1378790086,1378790086,1378790086,"新疆维吾尔自治区阿克苏市林园","许可经营项目：道路普通货物运输；货物专用运输（罐式容器），货车维修（二类）（仅限所属分支机构经营）；成品油零售（仅限所属分支机构经营）。一般经营项目：磷肥、硫酸钾、复合肥、重晶石粉的生产销售；水泥、水泥熟料、预应力多孔板、加气砼砌块、水泥预制构件、石灰粉、石料、建筑涂料的生产销售；洗车服务；润滑油、汽车零配件、钢材、化工产品、建材、五金交电、机电设备、日用百货的销售；铸造件、通用零部件、机械设备安装；场地租赁。"
"600426.XSHG","600426","XSHG",1,"主板","CNY","华鲁恒升","山东华鲁恒升化工股份有限公司","L","2002-06-20",,"A","沪深A股","CHN",968,953625000,953625000,953625000,"山东省德州市德城区天衢西路24号","化学肥料、醇类、醛类、树脂、胺类、羰基化合物、液氮、液氧、液氩、氢气、一氧化碳、液体无水氨及氨水、硫磺的生产、销售；资格证书范围内的进出口业务。"
"600428.XSHG","600428","XSHG",1,"主板","CNY","中远航运","中远航运股份有限公司","L","2002-04-18",,"A","沪深A股","CHN",969,1690446393,1690446393,1690446393,"广东省广州市珠江新城花城大道20号广州远洋大厦","国际船舶代理;水上运输设备租赁服务;水上运输设备批发;金属船舶制造;非金属船舶制造;船舶修理;装卸搬运;海洋工程建筑;提供施工设备服务;工程环保设施施工;工程围栏装卸施工;土石方工程服务;工程排水施工服务;其他仓储业（不含原油、成品油仓储、燃气仓储、危险品仓储）;通讯设备修理;软件开发;信息系统集成服务;货物运输代理;货物进出口（专营专控商品除外）;技术进出口;房地产开发经营;自有房地产经营活动;物业管理;汽车租赁;律师及相关法律服务;广告业;海运及海运辅助业人员培训;室内装饰、设计;工程管理服务;工程技术咨询服务;工程建设项目招标代理服务;房屋建筑工程设计服务;房地产咨询、中介服务;商品信息咨询服务;单位后勤管理服务（涉及许可经营的项目除外）;纺织品、针织品及原料批发;厨房、卫生间用具及日用杂货批发;文具用品批发;五金产品批发;贸易代理;纺织品及针织品零售;厨房用具及日用杂品零售;文具用品零售;五金零售;沿海货物运输;远洋货物运输;职业中介服务;劳务派遣服务;人才中介服务;境外就业中介服务;国际船舶管理;专业停车场服务;酒店住宿服务（旅业）;非酒精饮料、茶叶批发;酒类批发;非酒精饮料及茶叶零售;酒类零售;烟草制品零售。"
"600429.XSHG","600429","XSHG",1,"主板","CNY","三元股份","北京三元食品股份有限公司","L","2003-09-15",,"A","沪深A股","CHN",970,1497557426,885000000,885000000,"北京市大兴区瀛海瀛昌街8号","加工乳品、饮料、食品、原材料、保健食品、冷食冷饮、生产乳品机械、食品机械；开发、生产生物工程技术产品（不包括基因产品）；信息咨询；餐饮；自产产品的冷藏运输；自有房屋出租；物业管理；安装、修理、租赁自有/剩余乳品机械和设备（非融资租赁）；销售自产产品。"
"600432.XSHG","600432","XSHG",1,"主板","CNY","吉恩镍业","吉林吉恩镍业股份有限公司","L","2003-09-05",,"A","沪深A股","CHN",971,1603723916,811121542,811121542,"吉林省吉林市磐石市红旗岭镇红旗大街54号","镍、铜、钴、硫冶炼及副产品加工；企业经营本企业自产产品及相关技术的出口业务；经营本企业生产、科研所需的原辅材料、机械设备、仪器仪表、零配件及相关技术的进口业务；经营本企业的进料加工“三来一补”业务；工业硫酸生产（安全许可证有效期至2011年10月5日）；镍矿开采（采矿许证可有效期至2015年8月）；液氧、液氩、液氮生产和销售。具体经营范围以登记机关核准为准。"
"600433.XSHG","600433","XSHG",1,"主板","CNY","冠豪高新","广东冠豪高新技术股份有限公司","L","2003-06-19",,"A","沪深A股","CHN",972,1271315443,1190280000,1190280000,"广东省湛江市东海岛东海大道313号","本企业自产产品及技术的进出口；生产所需原辅材料等商品及技术的进口；进料加工和“三来一补”(按[2000]粤外经贸登字第002号文经营)。生产、销售热敏传真纸及其原-4-纸、无碳复写纸及其原纸、微胶囊、电脑打印纸、商业表格纸，科学仪器记录纸、小卷传真纸、感应纸、彩色喷墨打印纸、特种防伪纸等特种纸及从事商业表格印刷业务。从事不干胶材料和离型纸的研发、生产、销售及综合应用服务。"
"600435.XSHG","600435","XSHG",1,"主板","CNY","北方导航","北方导航控制技术股份有限公司","L","2003-07-04",,"A","沪深A股","CHN",973,744660000,744660000,744660000,"北京市亦庄经济技术开发区科创十五街2号","纺织服装业自动化成套设备及零配件、电子计算机软硬件及外部设备、机电一体化产品的技术开发、技术服务、制造、销售；网络技术开发、技术服务；经营本企业和成员企业自产产品及技术出口业务；本企业和成员企业生产所需的原辅材料、仪器仪表、机械设备、零配件及技术的进口业务（国家限定公司经营和国家禁止进出口的商品除外）；经营进料加工、\"三来一补\"业务；普通货物运输。"
"600436.XSHG","600436","XSHG",1,"主板","CNY","片仔癀","漳州片仔癀药业股份有限公司","L","2003-06-16",,"A","沪深A股","CHN",974,160884589,160884589,160884589,"福建省漳州市芗城区上街1号","锭剂、片剂、颗粒剂、胶囊剂、软膏剂、糖浆剂、酊剂（含外用）、煎膏剂、丸剂（水丸、水蜜丸）、乳膏剂、中药饮片的生产、蜂产品（蜂产品制品）、糖果制品（糖果）；经营本企业所生产产品及相关技术的出口业务，经营本企业所需的原辅材料设备、技术的进口业务；承办本企业中外合资经营、合作生产业务；承办本企业来料加工、来样加工、来件装配业务；开展本企业补偿贸易业务、经营旅游商品。（以上经营范围凡涉及许可经营项目的，应在取得有关部门的许可后方可经营）。"
"600438.XSHG","600438","XSHG",1,"主板","CNY","通威股份","通威股份有限公司","L","2004-03-02",,"A","沪深A股","CHN",975,817109632,687520000,687520000,"四川省成都市高新区天府大道中段588号"通威国际中心"","生产饲料及饲料添加剂；销售兽药；收购粮食；委托加工；（以上经营项目与期限以许可证为准，且仅限分支机构经营）（以下项目不含前置许可项目，后置许可项目凭许可证或审批文件经营）非全民水域的水产养殖及技术咨询服务、畜禽养殖及技术咨询服务；生产电子元器件、电子计算机、化工产品；商品批发与零售；进出口业；租赁业。"
"600439.XSHG","600439","XSHG",1,"主板","CNY","瑞贝卡","河南瑞贝卡发制品股份有限公司","L","2003-07-10",,"A","沪深A股","CHN",976,943321200,943321200,943321200,"河南省许昌市瑞贝卡大道666号","生产、销售发制品系列产品及技术服务；生产、销售复合纤维材料及特种纤维材料；经营本公司自产产品及原材料和相关技术的出口业务；经营本公司生产、科研所需的原辅材料、机械设备、仪器仪表、零配件及相关技术的进口业务；经营本公司的进料加工和\"三来一补\"业务。"
"600444.XSHG","600444","XSHG",1,"主板","CNY","国通管业","安徽国通高新管业股份有限公司","L","2004-02-19",,"A","沪深A股","CHN",977,105000000,105000000,105000000,"安徽省合肥市经济技术开发区繁华大道国通工业园","UPVC管、PE管、PP-R管等各种塑料管材、金属塑料复合管材及管件生产、销售、安装服务、技术研究、开发；自营和代理各类商品和技术进出口业务（国家限定企业经营或禁止进出口的商品和技术除外）；市政工程施工及管道安装。"
"600446.XSHG","600446","XSHG",1,"主板","CNY","金证股份","深圳市金证科技股份有限公司","L","2003-12-24",,"A","沪深A股","CHN",978,265635500,265635500,265635500,"广东省深圳市南山区高新南五道金证科技大楼(8-9层)","计算机应用系统及配套设备的技术开发、生产(生产项目另行申报)、销售；电子产品、通讯器材、机械设备的购销及国内商业，物资供销业（不含专营、专控、专卖商品及限制项目）。进出口业务（具体按深贸管准证字第2003-2435号文执行）。建筑智能化工程专业（凭《建筑业企业资质证书》经营）。专业音响、灯光、多媒体显示、会议、公共广播设备、闭路监控设计、工程与购销。"
"600448.XSHG","600448","XSHG",1,"主板","CNY","华纺股份","华纺股份有限公司","L","2001-09-03",,"A","沪深A股","CHN",979,422364101,399393660,399393660,"山东省滨州市黄河二路819号","棉纺织、毛纺织、印染布料三大系列。"
"600449.XSHG","600449","XSHG",1,"主板","CNY","宁夏建材","宁夏建材集团股份有限公司","L","2003-08-29",,"A","沪深A股","CHN",980,478181042,478181042,478181042,"宁夏回族自治区银川市金凤区人民广场东街219号建材大厦","水泥制造、销售，水泥制品、水泥熟料、塑料管材、精细石膏的制造与销售。"
"600452.XSHG","600452","XSHG",1,"主板","CNY","涪陵电力","重庆涪陵电力实业股份有限公司","L","2004-03-03",,"A","沪深A股","CHN",981,160000000,160000000,160000000,"重庆市涪陵区望州路20号","电力供应、销售，电力资源开发及信息咨询服务，商贸信息咨询服务（不含国家有专项管理规定的项目）。"
"600455.XSHG","600455","XSHG",1,"主板","CNY","博通股份","西安博通资讯股份有限公司","L","2004-03-29",,"A","沪深A股","CHN",982,62458000,49717768,49717768,"陕西省西安市高新技术开发区东区火炬路3号楼10层C座","大型企业应用软件及相关硬件产品、通信及网络设备的开发、生产、销售及技术服务；系统集成；项目监理、咨询；软件开发；经营本公司自产产品及技术的出口业务；经营本公司生产所需的原辅材料、仪器仪表、机械设备、零配件及技术的进口业务；经营进料加工和“三来一补”业务。"
"600456.XSHG","600456","XSHG",1,"主板","CNY","宝钛股份","宝鸡钛业股份有限公司","L","2002-04-12",,"A","沪深A股","CHN",983,430265700,430265700,430265700,"陕西省宝鸡市钛城路1号","钛及钛合金材料的生产、加工和销售。"
"600458.XSHG","600458","XSHG",1,"主板","CNY","时代新材","株洲时代新材料科技股份有限公司","L","2002-12-19",,"A","沪深A股","CHN",984,661422092,661422092,661422092,"湖南省株洲市天元区海天路18号","轨道交通装备零部件的开发、设计、制造、销售；橡塑元件开发；橡胶、塑料模具制造；风力发电机组零配件及复合材料制品开发、设计、制造、销售；桥梁支座，伸缩缝，铁路配件、橡胶制品、塑料制品、胶木制品和机械零配件生产、加工并提供技术咨询服务；电器机械及器材、百货、五金、交电、胶木制品及政策允许的金属材料、化工原料销售；建筑工程隔震减震产品、聚氨酯材料制品的开发、设计、制造、销售。"
"600459.XSHG","600459","XSHG",1,"主板","CNY","贵研铂业","贵研铂业股份有限公司","L","2003-05-16",,"A","沪深A股","CHN",985,260977742,260977742,260977742,"云南省昆明市高新技术开发区科技路988号","贵金属(含金)信息功能材料、环保材料、高纯材料、电气功能材料及相关合金、化合物的研究、开发、生产、销售；含贵金属(含金)物料综合回收利用；工程科学技术及技术服务，分析仪器，金属材料实验机及实验用品；贵金属冶金技术设备，有色金属及制品；经营本单位研制开发的技术和技术产品的出口业务以及本单位自用的技术、设备和原辅材料的进口业务；进行国内、外科技交流和科技合作。"
"600460.XSHG","600460","XSHG",1,"主板","CNY","士兰微","杭州士兰微电子股份有限公司","L","2003-03-11",,"A","沪深A股","CHN",986,1247168000,1247168000,1247168000,"浙江省杭州市黄姑山路4号","电子元器件、电子零器件及其他电子产品设计、制造和销售；进出口业务。"
"600461.XSHG","600461","XSHG",1,"主板","CNY","洪城水业","江西洪城水业股份有限公司","L","2004-06-01",,"A","沪深A股","CHN",987,330000000,330000000,330000000,"江西省南昌市灌婴路99号","自来水、水表、给排水设备、节水设备、仪器仪表、环保设备的生产、销售，给排水设施的安装、修理；给排水工程设计、安装、技术咨询及培训，软件应用服务，水质检测、水表计量检测、电子计量器具的研制及销售、城市污水处理，房地产开发与经营、信息技术。（以上项目国家有专项规定的除外）。"
