secID,ticker,exchangeCD,ListSectorCD,ListSector,transCurrCD,secShortName,secFullName,listStatusCD,listDate,delistDate,equTypeCD,equType,exCountryCD,partyID,totalShares,nonrestFloatShares,nonrestfloatA,officeAddr,primeOperating
"002189.XSHE","002189","XSHE",3,"中小板","CNY","利达光电","利达光电股份有限公司","L","2007-12-03",,"A","沪深A股","CHN",27954,199240000,198800275,198800275,"河南省南阳市工业南路508号","光学零件、光学薄膜产品、光敏电阻、光学镜头、光学引擎、光学辅料、光电仪器及相关产品的研发、生产、销售和售后服务。"
"002190.XSHE","002190","XSHE",3,"中小板","CNY","成飞集成","四川成飞集成科技股份有限公司","L","2007-12-03",,"A","沪深A股","CHN",31282,345188382,345032622,345032622,"四川省成都市青羊区日月大道666号附1号","模具的设计、研发、生产（另设分支机构或另择经营场地经营）；计算机集成技术开发与应用；货物进出口、技术进出口；（以上经营范围依法须经批准的项目，经相关部门批准后方可开展经营活动）。"
"002191.XSHE","002191","XSHE",3,"中小板","CNY","劲嘉股份","深圳劲嘉彩印集团股份有限公司","L","2007-12-05",,"A","沪深A股","CHN",31283,656650000,642000000,642000000,"广东省深圳市南山区高新技术产业园区科技中二路劲嘉科技大厦18-19层","包装材料及印刷材料技术的设计、研发；转让自行开发的技术成果，从事企业形象策划，经济信息咨询，计算机软件开发；自有物业租赁；承接包装材料的制版、印刷及生产业务（仅限于分支机构）。"
"002192.XSHE","002192","XSHE",3,"中小板","CNY","*ST路翔","路翔股份有限公司","L","2007-12-05",,"A","沪深A股","CHN",27907,142103469,101860426,101860426,"广东省广州市天河北路890号9楼","改性沥青制造、加工与销售（危险化学品除外）；改性沥青设备制造、销售及租赁；改性沥青技术信息咨询服务；沥青销售；仓储服务（危险化学品除外）；改性沥青成套设备技术开发，高新技术开发，技术成果转让；高速公路配套设备研究、开发；建筑工程机械设备销售；基础化学原料制造（化学危险品除外）；批发和零售贸易（国家专营专控商品除外）；货物进出口、技术进出口（法律、法规禁止的项目除外，法律、法规限制的项目须取得许可证后方可经营）；矿业投资；矿业技术及产品的开发。"
"002193.XSHE","002193","XSHE",3,"中小板","CNY","山东如意","山东济宁如意毛纺织股份有限公司","L","2007-12-07",,"A","沪深A股","CHN",31264,160000000,159912767,159912767,"山东省济宁市高新区如意工业园","纺织品、纺织机械及配件、纺织原料及辅料等相关产品的生产、销售；备案范围进出口业务，主要产品为精纺呢绒。"
"002194.XSHE","002194","XSHE",3,"中小板","CNY","武汉凡谷","武汉凡谷电子技术股份有限公司","L","2007-12-07",,"A","沪深A股","CHN",31317,555880000,309814839,309814839,"湖北省武汉市江夏区关凤路藏龙岛科技园","通讯、电子、计算机软件开发、研制、技术服务；通讯设备制造；线路安装；仪器仪表、电子元器件、计算机零售兼批发；自营和代理各类商品和技术的进出口，但国家限定公司经营或进出口的商品和技术除外。本公司主要产品：双工器、滤波器、射频子系统。"
"002195.XSHE","002195","XSHE",3,"中小板","CNY","二三四五","上海二三四五网络控股集团股份有限公司","L","2007-12-12",,"A","沪深A股","CHN",31316,871732720,146848780,146848780,"上海市宜山路700号普天信息产业园2号楼12楼","计算机软、硬件系统及相关系统的集成、开发、咨询、销售及服务，经营本企业自产产品的出口业务和本企业所需的机械设备、零配件、原辅材料的进出口业务（国家限定公司经营或禁止进出口的商品及技术除外），本企业包括本企业控股的成员企业信息服务业务（不含互联网信息服务业务，电话信息服务业务）。"
"002196.XSHE","002196","XSHE",3,"中小板","CNY","方正电机","浙江方正电机股份有限公司","L","2007-12-12",,"A","沪深A股","CHN",31261,178331044,89978090,89978090,"浙江省丽水市天宁工业区24号","微特电机的研发、生产、销售为主营业务，并同时经营相关设备、产品的进出口业务。主要产品：家用缝纫机电机、工业用缝纫机电机、缝纫机用变频调速伺服电机、电脑高速自动平缝机、汽车电机。"
"002197.XSHE","002197","XSHE",3,"中小板","CNY","证通电子","深圳市证通电子股份有限公司","L","2007-12-18",,"A","沪深A股","CHN",31351,267947745,210535146,210535146,"广东省深圳市光明新区松白路甲子塘证通电子产业园","电脑系统POS磁卡条码设备，办公自动化设备，通讯设备，支付电话设备，移动用户终端，无线固定电话机，经国家密码管理机构批准的商用密码产品的开发、生产、维护保养及相关技术咨询(以上均不含通信手机及限制项目)；LED照明、太阳能应用系统工程建设及施工；进出口业务(具体按深贸管登证字第2001－101号资格证书办)。"
"002198.XSHE","002198","XSHE",3,"中小板","CNY","嘉应制药","广东嘉应制药股份有限公司","L","2007-12-18",,"A","沪深A股","CHN",31347,507509848,374285648,374285648,"广东省梅州市东升工业园B区","生产：片剂，胶囊剂，颗粒剂，丸剂（密丸、水密丸、水丸），散剂，中药前处理和提取车间（口服制剂）〔药品生产许可证有效期至2010年12月31日〕。货物进出口、技术进出口（法律、行政法规禁止的项目除外；法律、行政法规限制的项目须取得许可后方可经营）。"
"002199.XSHE","002199","XSHE",3,"中小板","CNY","东晶电子","浙江东晶电子股份有限公司","L","2007-12-21",,"A","沪深A股","CHN",31344,243442363,141151287,141151287,"浙江省金华市宾虹西路555号","石英晶体谐振器、瓷介管状电容器的生产、销售。"
"002200.XSHE","002200","XSHE",3,"中小板","CNY","云投生态","云南云投生态环境科技股份有限公司","L","2007-12-21",,"A","沪深A股","CHN",31343,184132890,107829119,107829119,"云南省昆明市经济技术开发区经浦路6号","植物种苗工厂化生产；市政公用、园林绿化工程的设计和施工、园林养护；生态修复、环境治理、水土保持、生态环保产品的开发与应用（不含管理商品）；工程技术咨询；观赏植物及盆景的生产、销售及租赁；生物资源开发、生物技术的开发、应用及推广；植物科研、培训、示范推广；园林机械、园林资材的生产及销售；项目投资。（依法须经批准的项目，经相关部门批准后方可开展经营活动）。"
"002201.XSHE","002201","XSHE",3,"中小板","CNY","九鼎新材","江苏九鼎新材料股份有限公司","L","2007-12-26",,"A","沪深A股","CHN",31357,228488000,217666355,217666355,"江苏省南通市如皋市中山东路1号","玻璃纤维纱、织物及制品、玻璃钢制品、其它产业纤维的织物及制品、建筑及装饰增强材料的生产、销售；经营本企业自产产品及技术的出口业务和本企业所需的机械设备、零配件、原辅材料及技术的进口业务（国家限定公司经营或禁止进出口的商品及技术除外）。"
"002202.XSHE","002202","XSHE",3,"中小板","CNY","金风科技","新疆金风科技股份有限公司","L","2007-12-26",,"A","沪深A股","CHN",31377,2694588000,2638581427,2138534627,"北京市北京经济技术开发区博兴一路8号","大型风力发电机组生产销售及技术引进与开发、应用；建设及运营中试型风力发电场（法律法规规定应取得相关行政许可的，在取得许可后方可从事）；制造及销售风力发电机零部件；有关风机制造、风电场建设运营方面的技术服务与技术咨询；风力发电机组及其零部件与相关技术的进出口业务。（但国家限定公司经营或禁止进出口的商品及技术除外）。"
"002203.XSHE","002203","XSHE",3,"中小板","CNY","海亮股份","浙江海亮股份有限公司","L","2008-01-16",,"A","沪深A股","CHN",31372,1548036626,1461516152,1461516152,"浙江省绍兴市诸暨市店口镇工业区","铜管、铜板带、铜箔及其他铜制品的制造、加工。"
"002204.XSHE","002204","XSHE",3,"中小板","CNY","大连重工","大连华锐重工集团股份有限公司","L","2008-01-16",,"A","沪深A股","CHN",31406,965685016,965685016,965685016,"辽宁省大连市西岗区八一路169号","铸钢件、铸铁件、铸铜件、锻件加工制造；钢锭铸胚、防尘设备设计制造安装调试；铸造工艺及材料技术开发；造型材料制造；模型模具设计制造；金属制品、通用机械设备及备件制造等。本公司的主要产品包括：铸钢、铸铁件等，主要应用于电站、船用、机械制造等。"
"002205.XSHE","002205","XSHE",3,"中小板","CNY","国统股份","新疆国统管道股份有限公司","L","2008-01-23",,"A","沪深A股","CHN",19511,116152018,116152018,116152018,"新疆维吾尔自治区乌鲁木齐市林泉西路765号","预应力钢筒砼管、各种输水管道及其异型管件、配件的开发制造；钢筋混凝土管片、混凝土预制构件、水泥制品的生产销售及与其相关的技术开发和咨询服务；普通货物运输和大型货物运输；水工金属结构（钢结构、机械设备）及化工建材的生产，管道工程专业承包。公司主要产品为预应力钢筒砼管、各种输水管道及其异型管件。"
"002206.XSHE","002206","XSHE",3,"中小板","CNY","海利得","浙江海利得新材料股份有限公司","L","2008-01-23",,"A","沪深A股","CHN",31549,449770500,342889900,342889900,"浙江省海宁市经编产业园区新民路18号","电脑喷绘胶片布、高速公路专用格栅布、PVC 涂层材料、聚酯工业长丝、高分子材料及产品的研究开发、生产、销售；经营进出口业务。"
"002207.XSHE","002207","XSHE",3,"中小板","CNY","准油股份","新疆准东石油技术股份有限公司","L","2008-01-28",,"A","沪深A股","CHN",31536,239177378,173330020,173330020,"新疆维吾尔自治区昌吉回族自治州阜康市准东石油基地","公司的主营业务属于石油技术服务行业，主要从事油田技术服务、油田新技术的研究及推广、采油技术咨询、化工石油工程施工、防腐保温工程、公路工程施工、房屋建筑施工、送变电工程施工、运输服务等。"
"002208.XSHE","002208","XSHE",3,"中小板","CNY","合肥城建","合肥城建发展股份有限公司","L","2008-01-28",,"A","沪深A股","CHN",31263,320100000,316716114,316716114,"安徽省合肥市长江中路319号仁和大厦23-24层","房地产开发及商品房销售、租赁、售后服务；城市基础设施及公用设施项目开发和经营；建材产品开发、生产、销售；工业、民用建筑技术咨询；室内装饰（以上项目需要许可证的一律凭证经营）。"
"002209.XSHE","002209","XSHE",3,"中小板","CNY","达意隆","广州达意隆包装机械股份有限公司","L","2008-01-30",,"A","沪深A股","CHN",31606,195244050,126596167,126596167,"广东省广州市萝岗区云埔一路23号","通用设备制造业：工程和技术研究和试验发展；工程和技术基础科学研究服务；机械技术开发服务；机械零部件加工；塑料加工专用设备制造；包装专用设备制造；电器辅件、配电或控制设备的零件制造；食品、酒、饮料及茶生产专用设备制造；模具制造；通用设备修理；专用设备修理；机械设备租赁；机械技术咨询、交流服务；投资咨询服务；机电设备安装服务；专用设备安装（电梯、锅炉除外）；机电设备安装工程专业承包；电力工程设计服务；机械工程设计服务；自有房地产经营活动；商品零售贸易（许可审批类商品除外）；商品批发贸易（许可审批类商品除外）；电气设备零售；塑料制品批发；机械配件批发；通用机械设备销售；电气机械设备销售；货物进出口（专营专控商品除外）；技术进出口；塑料包装箱及容器制造（仅限分支机构经营）；肥皂及合成洗涤剂制造（仅限分支机构经营）；瓶（罐）装饮用水制造（仅限分支机构经营）；茶饮料及其他饮料制造（仅限分支机构经营）；碳酸饮料制造（仅限分支机构经营）；果菜汁及果菜汁饮料制造（仅限分支机构经营）。"
"002210.XSHE","002210","XSHE",3,"中小板","CNY","飞马国际","深圳市飞马国际供应链股份有限公司","L","2008-01-30",,"A","沪深A股","CHN",31742,397800000,384923213,384923213,"广东省深圳市福田区深南大道7008号阳光高尔夫大厦2601室","国内商业（不含限制项目）；物资供销业（不含专营、专控、专卖商品）；经营进出口及相关配套业务；交通运输业、装卸搬运和其他运输服务业、仓储业；租赁和商务服务业；其他金融服务业；批发业；供应链管理及相关配套服务；投资兴办实业；计算机软硬件开发。（以上不含法律、政策法规、国务院决定规定禁止的及需前置审批的项目，限制的项目需取得许可后方可经营。）。交通运输业、装卸搬运和其他运输服务业、仓储业。"
"002211.XSHE","002211","XSHE",3,"中小板","CNY","宏达新材","江苏宏达新材料股份有限公司","L","2008-02-01",,"A","沪深A股","CHN",31853,432475779,277617678,277617678,"江苏省镇江市扬中市明珠广场","有机硅单体及副产品的生产加工，生产销售硅油、硅橡胶及其制品、高分子材料和石油化工配件，自营和代理各类商品及技术的进出口业务。"
"002212.XSHE","002212","XSHE",3,"中小板","CNY","南洋股份","广东南洋电缆集团股份有限公司","L","2008-02-01",,"A","沪深A股","CHN",32005,510260000,290443239,290443239,"广东省汕头市珠津工业区珠津二街1号","经营本企业自产产品的出口业务；经营本企业生产所需机械设备、零配件及其他原辅材料的进口业务；布电线，电力电缆，低压电器及元件，塑料制品的加工、制造。（凡涉专项规定应持有效期内专批证件方可经营）。"
"002213.XSHE","002213","XSHE",3,"中小板","CNY","特尔佳","深圳市特尔佳科技股份有限公司","L","2008-02-01",,"A","沪深A股","CHN",31854,206000000,137107900,137107910,"广东省深圳市宝安区观澜高新技术产业园特尔佳观澜厂区","本公司属运输科技产品生产企业，主要从事运输科技产品及机电设备开发、技术咨询、国内商业、物资供销业；销售电涡流缓速器及兴办实业。"
"002214.XSHE","002214","XSHE",3,"中小板","CNY","大立科技","浙江大立科技股份有限公司","L","2008-02-18",,"A","沪深A股","CHN",32173,229333333,172925106,172925106,"浙江省杭州市高新技术开发区(滨江)滨康路639号","机电设备、计算机、软件及网络工程、电子产品、测试技术的投资开发及技术转让、技术咨询、技术服务；机电设备（不含汽车）、电子产品、化工产品（不含危险品）、计算机及软件的生产、销售（凭环保审批意见生产）；计算机网络工程安装；经营进出口业务（范围详见《中华人民共和国进出口企业资格证书》）。主要产品或提供的劳务：红外热像仪系列产品、DVR 系列产品及视频监控系统等。"
"002215.XSHE","002215","XSHE",3,"中小板","CNY","诺普信","深圳诺普信农化股份有限公司","L","2008-02-18",,"A","沪深A股","CHN",32073,703825980,519809180,519809180,"广东省深圳市宝安区西乡水库路113号","农药加工、复配（按国家石油和化学工业局农药生产批准证书办理），农化产品应用技术研究；农药销售；货物及技术进出口（以上不含法律、行政法规、国务院决定规定需前置审批及禁止的项目）。"
"002216.XSHE","002216","XSHE",3,"中小板","CNY","三全食品","三全食品股份有限公司","L","2008-02-20",,"A","沪深A股","CHN",32006,402108766,278555566,278555566,"河南省郑州市综合投资区长兴路中段","速冻食品、方便快餐食品、冷冻饮品的生产与销售。上述自产产品的同类商品的批发、佣金代理（拍卖除外）。本公司属速冻食品行业，主要从事速冻食品的加工和销售。"
"002217.XSHE","002217","XSHE",3,"中小板","CNY","合力泰","合力泰科技股份有限公司","L","2008-02-20",,"A","沪深A股","CHN",32176,1078428000,368593949,368593949,"山东省淄博市沂源县城东风路36号","生产经营本企业自产产品及技术的出口业务，企业生产、科研所需的原辅材料、仪器仪表、机械设备、零配件及技术的进出口业务（国家限定公司经营和国家禁止进出口的商品及技术除外），经营进料加工和“三来一补”业务，硝酸、纯碱、氯化铵、硫化异丁烯、硝酸异辛酯、硝酸铵、硝酸钠、亚硝酸钠、三聚氰胺、氨水(≤10%)、液氨、尿素的生产、销售；硝基复合肥生产自销（国家法律法规禁止的项目除外，需经许可经营的，须凭许可证生产经营）。"
"002218.XSHE","002218","XSHE",3,"中小板","CNY","拓日新能","深圳市拓日新能源科技股份有限公司","L","2008-02-28",,"A","沪深A股","CHN",32178,618171052,479592600,479592600,"广东省深圳市南山区侨香路6060号香年广场A栋802-804","研发、生产及销售太阳电池芯片、太阳电池组件、太阳能供电电源、太阳能应用产品、太阳能集热板及热水器系统、风力发电设备、太阳电池生产线设备、太阳能控制器、太阳能逆变器、太阳能应用产品控制软件；设计、安装及销售太阳能热水器工程、风力发电工程、太阳能电站工程；经营进出口业务（法律、行政法规、国务院规定禁止的项目除外，限制的项目须取得许可后方可经营）。"
"002219.XSHE","002219","XSHE",3,"中小板","CNY","恒康医疗","恒康医疗集团股份有限公司","L","2008-03-06",,"A","沪深A股","CHN",32499,616329000,603479176,603479176,"四川省成都市锦江工业开发区金石路456号","片剂、糖浆剂、散剂、酒剂、硬胶囊剂、软胶囊剂、口服液、合剂、丸剂（微丸）、滴丸剂（含中药前处理、提取）、凝胶膏；中、藏药材种植、研究，高原生物开发、收购（国家明令禁止的除外），中药饮片；药品、食品、医疗器械的研究开发及技术咨询；日化用品、生物制品销售；医疗投资管理。"
"002220.XSHE","002220","XSHE",3,"中小板","CNY","天宝股份","大连天宝绿色食品股份有限公司","L","2008-02-28",,"A","沪深A股","CHN",32377,464727200,389481229,389481229,"辽宁省大连市金州区拥政街道三里村624号","进出口业务，经营本企业的进料加工和“三来一补”业务；农副产品（不含粮油）、土畜产品的种植、收购、加工、销售；水产品的收购、加工、销售；豆制品、冷冻食品的生产、加工、销售；仓储；服装、针纺织品、木材、木制品的销售；高科技术农业技术开发。"
"002221.XSHE","002221","XSHE",3,"中小板","CNY","东华能源","东华能源股份有限公司","L","2008-03-06",,"A","沪深A股","CHN",32376,692346184,447188330,447188330,"江苏省南京市仙林大道徐庄软件园紫气路1号","许可经营项目：生产、储存低温常压液化石油气，储存化工品（甲醇、正丙醇、异丙醇、正丁醇、异丁醇、甲苯、二甲苯、邻二甲苯、对二甲苯、苯乙烯、丙烷、丁烷）。一般经营项目：化工产品的仓储、批发、进出口及佣金代理（拍卖除外）（在商务部门批准的范围内经营），公司自产产品的售后技术服务。"
"002222.XSHE","002222","XSHE",3,"中小板","CNY","福晶科技","福建福晶科技股份有限公司","L","2008-03-19",,"A","沪深A股","CHN",32323,285000000,276115718,276115718,"福建省福州市鼓楼区软件大道89号福州软件园F区9号楼福晶科技园","光学晶体、晶体材料、激光器件的研发、制造销售及其技术咨询、技术服务。"
"002223.XSHE","002223","XSHE",3,"中小板","CNY","鱼跃医疗","江苏鱼跃医疗设备股份有限公司","L","2008-04-18",,"A","沪深A股","CHN",32700,531606400,445661682,445661682,"江苏省镇江市丹阳市云阳工业园","医疗器械和保健用品的生产和销售。"
"002224.XSHE","002224","XSHE",3,"中小板","CNY","三力士","三力士股份有限公司","L","2008-04-25",,"A","沪深A股","CHN",32498,654669698,441203432,441203432,"浙江省绍兴市绍兴县柯岩街道余渚村","三角胶带、胶管、橡胶制品的生产、销售（不含危险品），橡胶机械的生产、开发，橡胶工程用特种纺织品、纤维的生产，经营进出口业务。主要产品为三角带。"
"002225.XSHE","002225","XSHE",3,"中小板","CNY","濮耐股份","濮阳濮耐高温材料(集团)股份有限公司","L","2008-04-25",,"A","沪深A股","CHN",32701,887854411,549953350,549953350,"河南省濮阳市濮阳县西环路中段","耐火材料原料和制品，功能陶瓷材料，高温结构材料，水泥及建筑材料，冶金炉料及其他冶金配套产品，功能材料机构和配套施工机械设备的开发、设计、生产、销售及技术转让、设计安装、施工技术服务及出口业务，进口本企业生产、科研所需的原辅材料、机械设备、仪器仪表及零配件（国家实行核定的进口商品除外），经营来料加工和“三来一补”业务。"
"002226.XSHE","002226","XSHE",3,"中小板","CNY","江南化工","安徽江南化工股份有限公司","L","2008-05-06",,"A","沪深A股","CHN",32175,398285496,395504365,395504365,"安徽省合肥市政务文化新区怀宁路1639号平安大厦17楼","乳化炸药（胶状）、粉状乳化炸药、乳化炸药(胶状、现场混装车)、多孔粒状铵油炸药（现场混装车）、乳化粒状铵油炸药的生产和销售（许可证有效期至2013年6月1日），洗涤剂的生产和销售，乳化剂的生产（仅供本公司自用且化危品除外），包装箱的生产(仅供本公司自用)。主要产品为乳化炸药和粉状乳化炸药，主体生产设备主要有M型乳化炸药大产能微机控制生产线、新型微机控制连续化粉状乳化生产线等。"
"002227.XSHE","002227","XSHE",3,"中小板","CNY","奥特迅","深圳奥特迅电力设备股份有限公司","L","2008-05-06",,"A","沪深A股","CHN",32719,218713900,217464400,217464400,"广东省深圳市南山区高新南一道29号厂房南座二层D区","生产经营高频开关电源、电力电源设备、无功补偿装置、绝缘监测装置、高低压成套开关设备、蓄能电站设备、通信高压直流电源、光伏发电设备、铁路电源、通信基站电源、电动汽车充电设施及检测装置、蓄电池管理装置、有源滤波装置；从事上述产品及相关软件的开发，并提供相关技术服务。"
"002228.XSHE","002228","XSHE",3,"中小板","CNY","合兴包装","厦门合兴包装印刷股份有限公司","L","2008-05-08",,"A","沪深A股","CHN",32718,347504000,347504000,347504000,"福建省厦门市同安区工业集中区梧侣路19号","生产中高档瓦楞纸箱及纸、塑等各种包装印刷品，研究和开发新型彩色印刷产品；主要产品是纸箱、纸板、缓冲包装材料等。"
"002229.XSHE","002229","XSHE",3,"中小板","CNY","鸿博股份","鸿博股份有限公司","L","2008-05-08",,"A","沪深A股","CHN",32769,298186000,185118787,185118787,"福建省福州市金山开发区金达路136号","出版物（含内部书刊印刷）、包装装潢印刷品、其他印刷品印刷（含票证、票据印刷）（有效期至2014年3月）；磁卡、智能卡的研制与加工；热敏纸、UV油墨、印刷设备的销售；皮革证件、铜铝牌匾和不干胶的印刷；对外贸易；对金融业、文化、体育和娱乐业的投资；网络技术开发与服务；文化创意设计与服务；物联网技术开发与服务。（以上经营范围涉及许可经营项目的，应在取得有关部门的许可后方可经营）。"
"002230.XSHE","002230","XSHE",3,"中小板","CNY","科大讯飞","科大讯飞股份有限公司","L","2008-05-12",,"A","沪深A股","CHN",29262,801501746,578486664,578486664,"安徽省合肥市高新开发区望江西路666号","增值电信业务，专业技术人员培训，计算机软、硬件开发、生产和销售及技术服务，系统工程、信息服务，电子产品、计算机通信设备研制、销售，进出口业务，安全技术防范工程，房屋租赁，物业管理服务，设计、制作、代理、发布广告（以上依法须经批准的项目经相关部门批准后方可开展经营活动）。"
